{
  "schema_version": 1,
  "family_id": "NF.audrey",
  "family_key": "audrey-family",
  "origin_note": "Candidate family generated by scripts/name-pipeline from the pinned English Wiktionary entry Audrey and the entries that point to it. Every form is justified by that entry's translation table or by a {{given name}} parameter (eq=, dimof=, varof=) on the form's own pinned entry; a similar spelling alone never adds a form.",
  "meaning_note": "Do not collapse local full-name equivalents, borrowed spellings, transliterations, or short/pet forms. Character localization and user-name localization require their own policy/consent layer. This family says what the pinned sources list; it is not a promise that every bearer shares one name meaning.",
  "equivalence_sets": [
    {
      "equivalence_set_id": "NFEQ.audrey.full-feminine",
      "role": "full_feminine",
      "note": "Full-name forms and equivalents only. Short and pet forms are intentionally kept in separate equivalence sets.",
      "forms": [
        {
          "form_id": "NFF.audrey.en.audrey",
          "text": "Audrey",
          "language_tag": "en",
          "script": "Latn",
          "relation_type": "source_form",
          "usage": "unknown",
          "name_id": "name_en_audrey",
          "source_refs": [
            "src_wiktionary_en_audrey_oldid_93420406"
          ],
          "review_state": "candidate"
        },
        {
          "form_id": "NFF.audrey.bg.u41e_434_440_438",
          "text": "Одри",
          "language_tag": "bg",
          "script": "Cyrl",
          "relation_type": "local_equivalent",
          "usage": "unknown",
          "name_id": "name_bg_u41e_434_440_438",
          "source_refs": [
            "src_wiktionary_en_audrey_oldid_93420406"
          ],
          "note": "Listed in the pinned Audrey translation table; the form's own entry has no given-name sense in this language, so only the root entry supports it.",
          "review_state": "candidate"
        },
        {
          "form_id": "NFF.audrey.el.ontrei",
          "text": "Όντρεϊ",
          "language_tag": "el",
          "script": "Grek",
          "relation_type": "local_equivalent",
          "usage": "unknown",
          "name_id": "name_el_ontrei",
          "source_refs": [
            "src_wiktionary_en_audrey_oldid_93420406"
          ],
          "note": "Listed in the pinned Audrey translation table; the form's own entry has no given-name sense in this language, so only the root entry supports it.",
          "review_state": "candidate"
        },
        {
          "form_id": "NFF.audrey.el.etheldreda",
          "text": "Εθελδρέδα",
          "language_tag": "el",
          "script": "Grek",
          "relation_type": "local_equivalent",
          "usage": "unknown",
          "name_id": "name_el_etheldreda",
          "source_refs": [
            "src_wiktionary_en_audrey_oldid_93420406"
          ],
          "note": "Listed in the pinned Audrey translation table; the form's own entry has no given-name sense in this language, so only the root entry supports it.",
          "review_state": "candidate"
        },
        {
          "form_id": "NFF.audrey.el.ontre",
          "text": "Ωντρέ",
          "language_tag": "el",
          "script": "Grek",
          "relation_type": "local_equivalent",
          "usage": "unknown",
          "name_id": "name_el_ontre",
          "source_refs": [
            "src_wiktionary_en_audrey_oldid_93420406"
          ],
          "note": "Listed in the pinned Audrey translation table; the form's own entry has no given-name sense in this language, so only the root entry supports it.",
          "review_state": "candidate"
        },
        {
          "form_id": "NFF.audrey.fr.audrey",
          "text": "Audrey",
          "language_tag": "fr",
          "script": "Latn",
          "relation_type": "borrowed_adaptation",
          "usage": "unknown",
          "name_id": "name_fr_audrey",
          "source_refs": [
            "src_wiktionary_en_audrey_oldid_93420406"
          ],
          "note": "Own pinned entry: from English.",
          "review_state": "candidate"
        },
        {
          "form_id": "NFF.audrey.ja.odori",
          "text": "オードリー",
          "language_tag": "ja",
          "script": "Jpan",
          "relation_type": "local_equivalent",
          "usage": "unknown",
          "name_id": "name_ja_odori",
          "source_refs": [
            "src_wiktionary_en_audrey_oldid_93420406"
          ],
          "note": "Listed in the pinned Audrey translation table; the form's own entry has no given-name sense in this language, so only the root entry supports it.",
          "review_state": "candidate"
        },
        {
          "form_id": "NFF.audrey.mr.odri",
          "text": "ऑड्री",
          "language_tag": "mr",
          "script": "Deva",
          "relation_type": "local_equivalent",
          "usage": "unknown",
          "name_id": "name_mr_odri",
          "source_refs": [
            "src_wiktionary_en_audrey_oldid_93420406"
          ],
          "note": "Listed in the pinned Audrey translation table; the form's own entry has no given-name sense in this language, so only the root entry supports it.",
          "review_state": "candidate"
        },
        {
          "form_id": "NFF.audrey.ru.u41e_434_440_438",
          "text": "Одри",
          "language_tag": "ru",
          "script": "Cyrl",
          "relation_type": "local_equivalent",
          "usage": "unknown",
          "name_id": "name_ru_u41e_434_440_438",
          "source_refs": [
            "src_wiktionary_en_audrey_oldid_93420406"
          ],
          "note": "Listed in the pinned Audrey translation table; the form's own entry has no given-name sense in this language, so only the root entry supports it.",
          "review_state": "candidate"
        },
        {
          "form_id": "NFF.audrey.zh.aodeli",
          "text": "奧德麗",
          "language_tag": "zh",
          "script": "Hani",
          "relation_type": "local_equivalent",
          "usage": "unknown",
          "name_id": "name_zh_aodeli",
          "source_refs": [
            "src_wiktionary_en_audrey_oldid_93420406"
          ],
          "note": "Listed in the pinned Audrey translation table; the form's own entry has no given-name sense in this language, so only the root entry supports it.",
          "review_state": "candidate"
        }
      ]
    }
  ],
  "localization_policy": {
    "fallback_order": [
      "reviewed_local_equivalent",
      "reviewed_traditional_adaptation",
      "reviewed_transliteration",
      "preserve_entered_form"
    ],
    "never_cross_equivalence_sets_automatically": true,
    "book_override_allowed": true,
    "user_override_allowed": true
  },
  "source_refs": [
    "src_wiktionary_en_audrey_oldid_93420406"
  ],
  "review_state": "candidate"
}
