{
  "schema_version": 1,
  "family_id": "NF.ava",
  "family_key": "ava-family",
  "origin_note": "Candidate family generated by scripts/name-pipeline from the pinned English Wiktionary entry Ava and the entries that point to it. Every form is justified by that entry's translation table or by a {{given name}} parameter (eq=, dimof=, varof=) on the form's own pinned entry; a similar spelling alone never adds a form.",
  "meaning_note": "Do not collapse local full-name equivalents, borrowed spellings, transliterations, or short/pet forms. Character localization and user-name localization require their own policy/consent layer. This family says what the pinned sources list; it is not a promise that every bearer shares one name meaning.",
  "equivalence_sets": [
    {
      "equivalence_set_id": "NFEQ.ava.full-feminine",
      "role": "full_feminine",
      "note": "Full-name forms and equivalents only. Short and pet forms are intentionally kept in separate equivalence sets.",
      "forms": [
        {
          "form_id": "NFF.ava.en.ava",
          "text": "Ava",
          "language_tag": "en",
          "script": "Latn",
          "relation_type": "source_form",
          "usage": "unknown",
          "name_id": "name_en_ava",
          "source_refs": [
            "src_wiktionary_en_ava_oldid_92705036"
          ],
          "review_state": "candidate"
        }
      ]
    }
  ],
  "localization_policy": {
    "fallback_order": [
      "reviewed_local_equivalent",
      "reviewed_traditional_adaptation",
      "reviewed_transliteration",
      "preserve_entered_form"
    ],
    "never_cross_equivalence_sets_automatically": true,
    "book_override_allowed": true,
    "user_override_allowed": true
  },
  "source_refs": [
    "src_wiktionary_en_ava_oldid_92705036"
  ],
  "review_state": "candidate"
}
