{
  "schema_version": 1,
  "family_id": "NF.benedicta",
  "family_key": "benedicta-family",
  "origin_note": "Candidate family generated by scripts/name-pipeline from the pinned English Wiktionary entry Benedicta and the entries that point to it. Every form is justified by that entry's translation table or by a {{given name}} parameter (eq=, dimof=, varof=) on the form's own pinned entry; a similar spelling alone never adds a form.",
  "meaning_note": "Do not collapse local full-name equivalents, borrowed spellings, transliterations, or short/pet forms. Character localization and user-name localization require their own policy/consent layer. This family says what the pinned sources list; it is not a promise that every bearer shares one name meaning.",
  "equivalence_sets": [
    {
      "equivalence_set_id": "NFEQ.benedicta.full-feminine",
      "role": "full_feminine",
      "note": "Full-name forms and equivalents only. Short and pet forms are intentionally kept in separate equivalence sets.",
      "forms": [
        {
          "form_id": "NFF.benedicta.en.benedicta",
          "text": "Benedicta",
          "language_tag": "en",
          "script": "Latn",
          "relation_type": "source_form",
          "usage": "unknown",
          "name_id": "name_en_benedicta",
          "source_refs": [
            "src_wiktionary_en_benedicta_oldid_91687575"
          ],
          "review_state": "candidate"
        },
        {
          "form_id": "NFF.benedicta.da.benedikte",
          "text": "Benedikte",
          "language_tag": "da",
          "script": "Latn",
          "relation_type": "local_equivalent",
          "usage": "unknown",
          "name_id": "name_da_benedikte",
          "source_refs": [
            "src_wiktionary_en_benedicta_oldid_91687575",
            "src_wiktionary_en_benedikte_oldid_83825789"
          ],
          "review_state": "candidate"
        },
        {
          "form_id": "NFF.benedicta.fr.benedicte",
          "text": "Bénédicte",
          "language_tag": "fr",
          "script": "Latn",
          "relation_type": "local_equivalent",
          "usage": "unknown",
          "name_id": "name_fr_benedicte",
          "source_refs": [
            "src_wiktionary_en_benedicta_oldid_91687575",
            "src_wiktionary_en_benedicte_oldid_86487834"
          ],
          "review_state": "candidate"
        },
        {
          "form_id": "NFF.benedicta.it.benedetta",
          "text": "Benedetta",
          "language_tag": "it",
          "script": "Latn",
          "relation_type": "local_equivalent",
          "usage": "unknown",
          "name_id": "name_it_benedetta",
          "source_refs": [
            "src_wiktionary_en_benedetta_oldid_63097992",
            "src_wiktionary_en_benedicta_oldid_91687575"
          ],
          "review_state": "candidate"
        },
        {
          "form_id": "NFF.benedicta.pl.benedykta",
          "text": "Benedykta",
          "language_tag": "pl",
          "script": "Latn",
          "relation_type": "local_equivalent",
          "usage": "unknown",
          "name_id": "name_pl_benedykta",
          "source_refs": [
            "src_wiktionary_en_benedicta_oldid_91687575",
            "src_wiktionary_en_benedykta_oldid_91198272"
          ],
          "review_state": "candidate"
        },
        {
          "form_id": "NFF.benedicta.sq.benedeta",
          "text": "Benedeta",
          "language_tag": "sq",
          "script": "Latn",
          "relation_type": "local_equivalent",
          "usage": "unknown",
          "name_id": "name_sq_benedeta",
          "source_refs": [
            "src_wiktionary_en_benedeta_oldid_84092006",
            "src_wiktionary_en_benedicta_oldid_91687575"
          ],
          "review_state": "candidate"
        },
        {
          "form_id": "NFF.benedicta.sv.bengta",
          "text": "Bengta",
          "language_tag": "sv",
          "script": "Latn",
          "relation_type": "local_equivalent",
          "usage": "rare",
          "name_id": "name_sv_bengta",
          "source_refs": [
            "src_wiktionary_en_benedicta_oldid_91687575",
            "src_wiktionary_en_bengta_oldid_79550771"
          ],
          "review_state": "candidate"
        }
      ]
    }
  ],
  "localization_policy": {
    "fallback_order": [
      "reviewed_local_equivalent",
      "reviewed_traditional_adaptation",
      "reviewed_transliteration",
      "preserve_entered_form"
    ],
    "never_cross_equivalence_sets_automatically": true,
    "book_override_allowed": true,
    "user_override_allowed": true
  },
  "source_refs": [
    "src_wiktionary_en_benedeta_oldid_84092006",
    "src_wiktionary_en_benedetta_oldid_63097992",
    "src_wiktionary_en_benedicta_oldid_91687575",
    "src_wiktionary_en_benedicte_oldid_86487834",
    "src_wiktionary_en_benedikte_oldid_83825789",
    "src_wiktionary_en_benedykta_oldid_91198272",
    "src_wiktionary_en_bengta_oldid_79550771"
  ],
  "review_state": "candidate"
}
