{
  "schema_version": 1,
  "family_id": "NF.caitlin",
  "family_key": "caitlin-family",
  "origin_note": "Candidate family generated by scripts/name-pipeline from the pinned English Wiktionary entry Caitlin and the entries that point to it. Every form is justified by that entry's translation table or by a {{given name}} parameter (eq=, dimof=, varof=) on the form's own pinned entry; a similar spelling alone never adds a form.",
  "meaning_note": "Do not collapse local full-name equivalents, borrowed spellings, transliterations, or short/pet forms. Character localization and user-name localization require their own policy/consent layer. This family says what the pinned sources list; it is not a promise that every bearer shares one name meaning.",
  "equivalence_sets": [
    {
      "equivalence_set_id": "NFEQ.caitlin.full-feminine",
      "role": "full_feminine",
      "note": "Full-name forms and equivalents only. Short and pet forms are intentionally kept in separate equivalence sets.",
      "forms": [
        {
          "form_id": "NFF.caitlin.en.caitlin",
          "text": "Caitlin",
          "language_tag": "en",
          "script": "Latn",
          "relation_type": "source_form",
          "usage": "unknown",
          "name_id": "name_en_caitlin",
          "source_refs": [
            "src_wiktionary_en_caitlin_oldid_93367965"
          ],
          "review_state": "candidate"
        },
        {
          "form_id": "NFF.caitlin.bg.kejtlin",
          "text": "Кейтлин",
          "language_tag": "bg",
          "script": "Cyrl",
          "relation_type": "local_equivalent",
          "usage": "unknown",
          "name_id": "name_bg_kejtlin",
          "source_refs": [
            "src_wiktionary_en_caitlin_oldid_93367965",
            "src_wiktionary_en_u41a_435_439_442_43b_438_oldid_86761728"
          ],
          "review_state": "candidate"
        }
      ]
    },
    {
      "equivalence_set_id": "NFEQ.caitlin.short-feminine",
      "role": "short_feminine",
      "note": "Short, pet and diminutive forms. They are not substitutes for the full-name forms.",
      "forms": [
        {
          "form_id": "NFF.caitlin.en.cait",
          "text": "Cait",
          "language_tag": "en",
          "script": "Latn",
          "relation_type": "diminutive",
          "usage": "unknown",
          "name_id": "name_en_cait",
          "source_refs": [
            "src_wiktionary_en_cait_oldid_85135033"
          ],
          "note": "Own pinned entry: diminutive of Caitlin.",
          "review_state": "candidate"
        },
        {
          "form_id": "NFF.caitlin.en.caity",
          "text": "Caity",
          "language_tag": "en",
          "script": "Latn",
          "relation_type": "diminutive",
          "usage": "unknown",
          "name_id": "name_en_caity",
          "source_refs": [
            "src_wiktionary_en_caity_oldid_83835521"
          ],
          "note": "Own pinned entry: diminutive of Caitlin.",
          "review_state": "candidate"
        }
      ]
    }
  ],
  "localization_policy": {
    "fallback_order": [
      "reviewed_local_equivalent",
      "reviewed_traditional_adaptation",
      "reviewed_transliteration",
      "preserve_entered_form"
    ],
    "never_cross_equivalence_sets_automatically": true,
    "book_override_allowed": true,
    "user_override_allowed": true
  },
  "source_refs": [
    "src_wiktionary_en_cait_oldid_85135033",
    "src_wiktionary_en_caitlin_oldid_93367965",
    "src_wiktionary_en_caity_oldid_83835521",
    "src_wiktionary_en_u41a_435_439_442_43b_438_oldid_86761728"
  ],
  "review_state": "candidate"
}
