{
  "schema_version": 1,
  "family_id": "NF.angel",
  "family_key": "angel-family",
  "origin_note": "Candidate family generated by scripts/name-pipeline from the pinned English Wiktionary entry Angel and the entries that point to it. Every form is justified by that entry's translation table or by a {{given name}} parameter (eq=, dimof=, varof=) on the form's own pinned entry; a similar spelling alone never adds a form.",
  "meaning_note": "Do not collapse local full-name equivalents, borrowed spellings, transliterations, or short/pet forms. Character localization and user-name localization require their own policy/consent layer. This family says what the pinned sources list; it is not a promise that every bearer shares one name meaning.",
  "equivalence_sets": [
    {
      "equivalence_set_id": "NFEQ.angel.full-unisex",
      "role": "other",
      "note": "Full-name forms and equivalents the sources give for both genders. Short and pet forms are intentionally kept in separate equivalence sets.",
      "forms": [
        {
          "form_id": "NFF.angel.en.angel",
          "text": "Angel",
          "language_tag": "en",
          "script": "Latn",
          "relation_type": "source_form",
          "usage": "unknown",
          "name_id": "name_en_angel",
          "source_refs": [
            "src_wiktionary_en_angel_oldid_93486895"
          ],
          "review_state": "candidate"
        },
        {
          "form_id": "NFF.angel.es.angel",
          "text": "Ángel",
          "language_tag": "es",
          "script": "Latn",
          "relation_type": "local_equivalent",
          "usage": "unknown",
          "name_id": "name_es_angel",
          "source_refs": [
            "src_wiktionary_en_angel_oldid_93130674",
            "src_wiktionary_en_angel_oldid_93486895"
          ],
          "review_state": "candidate"
        },
        {
          "form_id": "NFF.angel.es.angelo",
          "text": "Ángelo",
          "language_tag": "es",
          "script": "Latn",
          "relation_type": "local_equivalent",
          "usage": "unknown",
          "name_id": "name_es_angelo",
          "source_refs": [
            "src_wiktionary_en_angel_oldid_93486895",
            "src_wiktionary_en_angelo_oldid_77541473"
          ],
          "review_state": "candidate"
        },
        {
          "form_id": "NFF.angel.it.angelo",
          "text": "Angelo",
          "language_tag": "it",
          "script": "Latn",
          "relation_type": "local_equivalent",
          "usage": "unknown",
          "name_id": "name_it_angelo",
          "source_refs": [
            "src_wiktionary_en_angel_oldid_93486895",
            "src_wiktionary_en_angelo_oldid_93041151"
          ],
          "review_state": "candidate"
        },
        {
          "form_id": "NFF.angel.mk.angel",
          "text": "Ангел",
          "language_tag": "mk",
          "script": "Cyrl",
          "relation_type": "local_equivalent",
          "usage": "unknown",
          "name_id": "name_mk_angel",
          "source_refs": [
            "src_wiktionary_en_angel_oldid_93486895",
            "src_wiktionary_en_u410_43d_433_435_43b_oldid_80456117"
          ],
          "review_state": "candidate"
        }
      ]
    }
  ],
  "localization_policy": {
    "fallback_order": [
      "reviewed_local_equivalent",
      "reviewed_traditional_adaptation",
      "reviewed_transliteration",
      "preserve_entered_form"
    ],
    "never_cross_equivalence_sets_automatically": true,
    "book_override_allowed": true,
    "user_override_allowed": true
  },
  "source_refs": [
    "src_wiktionary_en_angel_oldid_93130674",
    "src_wiktionary_en_angel_oldid_93486895",
    "src_wiktionary_en_angelo_oldid_77541473",
    "src_wiktionary_en_angelo_oldid_93041151",
    "src_wiktionary_en_u410_43d_433_435_43b_oldid_80456117"
  ],
  "review_state": "candidate"
}
