{
  "schema_version": 1,
  "family_id": "NF.amanda",
  "family_key": "amanda-family",
  "origin_note": "Candidate family generated by scripts/name-pipeline from the pinned English Wiktionary entry Amanda and the entries that point to it. Every form is justified by that entry's translation table or by a {{given name}} parameter (eq=, dimof=, varof=) on the form's own pinned entry; a similar spelling alone never adds a form.",
  "meaning_note": "Do not collapse local full-name equivalents, borrowed spellings, transliterations, or short/pet forms. Character localization and user-name localization require their own policy/consent layer. This family says what the pinned sources list; it is not a promise that every bearer shares one name meaning.",
  "equivalence_sets": [
    {
      "equivalence_set_id": "NFEQ.amanda.full-feminine",
      "role": "full_feminine",
      "note": "Full-name forms and equivalents only. Short and pet forms are intentionally kept in separate equivalence sets.",
      "forms": [
        {
          "form_id": "NFF.amanda.en.amanda",
          "text": "Amanda",
          "language_tag": "en",
          "script": "Latn",
          "relation_type": "source_form",
          "usage": "unknown",
          "name_id": "name_en_amanda",
          "source_refs": [
            "src_wiktionary_en_amanda_oldid_93130751"
          ],
          "review_state": "candidate"
        },
        {
          "form_id": "NFF.amanda.bg.amanda",
          "text": "Аманда",
          "language_tag": "bg",
          "script": "Cyrl",
          "relation_type": "local_equivalent",
          "usage": "unknown",
          "name_id": "name_bg_amanda",
          "source_refs": [
            "src_wiktionary_en_amanda_oldid_93130751",
            "src_wiktionary_en_u410_43c_430_43d_434_430_oldid_91111255"
          ],
          "review_state": "candidate"
        },
        {
          "form_id": "NFF.amanda.da.amanda",
          "text": "Amanda",
          "language_tag": "da",
          "script": "Latn",
          "relation_type": "local_equivalent",
          "usage": "unknown",
          "name_id": "name_da_amanda",
          "source_refs": [
            "src_wiktionary_en_amanda_oldid_93130751"
          ],
          "review_state": "candidate"
        },
        {
          "form_id": "NFF.amanda.de.amanda",
          "text": "Amanda",
          "language_tag": "de",
          "script": "Latn",
          "relation_type": "local_equivalent",
          "usage": "unknown",
          "name_id": "name_de_amanda",
          "source_refs": [
            "src_wiktionary_en_amanda_oldid_93130751"
          ],
          "review_state": "candidate"
        },
        {
          "form_id": "NFF.amanda.el.amanta",
          "text": "Αμάντα",
          "language_tag": "el",
          "script": "Grek",
          "relation_type": "local_equivalent",
          "usage": "unknown",
          "name_id": "name_el_amanta",
          "source_refs": [
            "src_wiktionary_en_amanda_oldid_93130751"
          ],
          "note": "Listed in the pinned Amanda translation table; the form's own entry has no given-name sense in this language, so only the root entry supports it.",
          "review_state": "candidate"
        },
        {
          "form_id": "NFF.amanda.es.amanda",
          "text": "Amanda",
          "language_tag": "es",
          "script": "Latn",
          "relation_type": "local_equivalent",
          "usage": "unknown",
          "name_id": "name_es_amanda",
          "source_refs": [
            "src_wiktionary_en_amanda_oldid_93130751"
          ],
          "review_state": "candidate"
        },
        {
          "form_id": "NFF.amanda.fi.amanda",
          "text": "Amanda",
          "language_tag": "fi",
          "script": "Latn",
          "relation_type": "local_equivalent",
          "usage": "unknown",
          "name_id": "name_fi_amanda",
          "source_refs": [
            "src_wiktionary_en_amanda_oldid_93130751"
          ],
          "review_state": "candidate"
        },
        {
          "form_id": "NFF.amanda.fr.amanda",
          "text": "Amanda",
          "language_tag": "fr",
          "script": "Latn",
          "relation_type": "local_equivalent",
          "usage": "unknown",
          "name_id": "name_fr_amanda",
          "source_refs": [
            "src_wiktionary_en_amanda_oldid_93130751"
          ],
          "review_state": "candidate"
        },
        {
          "form_id": "NFF.amanda.it.amanda",
          "text": "Amanda",
          "language_tag": "it",
          "script": "Latn",
          "relation_type": "local_equivalent",
          "usage": "unknown",
          "name_id": "name_it_amanda",
          "source_refs": [
            "src_wiktionary_en_amanda_oldid_93130751"
          ],
          "review_state": "candidate"
        },
        {
          "form_id": "NFF.amanda.nb.amanda",
          "text": "Amanda",
          "language_tag": "nb",
          "script": "Latn",
          "relation_type": "local_equivalent",
          "usage": "unknown",
          "name_id": "name_nb_amanda",
          "source_refs": [
            "src_wiktionary_en_amanda_oldid_93130751"
          ],
          "review_state": "candidate"
        },
        {
          "form_id": "NFF.amanda.nn.amanda",
          "text": "Amanda",
          "language_tag": "nn",
          "script": "Latn",
          "relation_type": "local_equivalent",
          "usage": "unknown",
          "name_id": "name_nn_amanda",
          "source_refs": [
            "src_wiktionary_en_amanda_oldid_93130751"
          ],
          "review_state": "candidate"
        },
        {
          "form_id": "NFF.amanda.pl.amanda",
          "text": "Amanda",
          "language_tag": "pl",
          "script": "Latn",
          "relation_type": "local_equivalent",
          "usage": "unknown",
          "name_id": "name_pl_amanda",
          "source_refs": [
            "src_wiktionary_en_amanda_oldid_93130751"
          ],
          "review_state": "candidate"
        },
        {
          "form_id": "NFF.amanda.pt.amanda",
          "text": "Amanda",
          "language_tag": "pt",
          "script": "Latn",
          "relation_type": "local_equivalent",
          "usage": "unknown",
          "name_id": "name_pt_amanda",
          "source_refs": [
            "src_wiktionary_en_amanda_oldid_93130751"
          ],
          "review_state": "candidate"
        },
        {
          "form_id": "NFF.amanda.ru.u410_43c_430_43d_434_430",
          "text": "Аманда",
          "language_tag": "ru",
          "script": "Cyrl",
          "relation_type": "local_equivalent",
          "usage": "unknown",
          "name_id": "name_ru_u410_43c_430_43d_434_430",
          "source_refs": [
            "src_wiktionary_en_amanda_oldid_93130751"
          ],
          "note": "Listed in the pinned Amanda translation table; the form's own entry has no given-name sense in this language, so only the root entry supports it.",
          "review_state": "candidate"
        },
        {
          "form_id": "NFF.amanda.sv.amanda",
          "text": "Amanda",
          "language_tag": "sv",
          "script": "Latn",
          "relation_type": "local_equivalent",
          "usage": "unknown",
          "name_id": "name_sv_amanda",
          "source_refs": [
            "src_wiktionary_en_amanda_oldid_93130751"
          ],
          "review_state": "candidate"
        }
      ]
    },
    {
      "equivalence_set_id": "NFEQ.amanda.short-feminine",
      "role": "short_feminine",
      "note": "Short, pet and diminutive forms. They are not substitutes for the full-name forms.",
      "forms": [
        {
          "form_id": "NFF.amanda.en.manda",
          "text": "Manda",
          "language_tag": "en",
          "script": "Latn",
          "relation_type": "diminutive",
          "usage": "unknown",
          "name_id": "name_en_manda",
          "source_refs": [
            "src_wiktionary_en_manda_oldid_89045697"
          ],
          "note": "Own pinned entry: diminutive of Amanda.",
          "review_state": "candidate"
        },
        {
          "form_id": "NFF.amanda.en.mandy",
          "text": "Mandy",
          "language_tag": "en",
          "script": "Latn",
          "relation_type": "diminutive",
          "usage": "unknown",
          "name_id": "name_en_mandy",
          "source_refs": [
            "src_wiktionary_en_mandy_oldid_91048070"
          ],
          "note": "Own pinned entry: diminutive of Amanda.",
          "review_state": "candidate"
        }
      ]
    }
  ],
  "localization_policy": {
    "fallback_order": [
      "reviewed_local_equivalent",
      "reviewed_traditional_adaptation",
      "reviewed_transliteration",
      "preserve_entered_form"
    ],
    "never_cross_equivalence_sets_automatically": true,
    "book_override_allowed": true,
    "user_override_allowed": true
  },
  "source_refs": [
    "src_wiktionary_en_amanda_oldid_93130751",
    "src_wiktionary_en_manda_oldid_89045697",
    "src_wiktionary_en_mandy_oldid_91048070",
    "src_wiktionary_en_u410_43c_430_43d_434_430_oldid_91111255"
  ],
  "review_state": "candidate"
}
