{
  "schema_version": 1,
  "family_id": "NF.calliope",
  "family_key": "calliope-family",
  "origin_note": "Candidate family generated by scripts/name-pipeline from the pinned English Wiktionary entry Calliope and the entries that point to it. Every form is justified by that entry's translation table or by a {{given name}} parameter (eq=, dimof=, varof=) on the form's own pinned entry; a similar spelling alone never adds a form.",
  "meaning_note": "Do not collapse local full-name equivalents, borrowed spellings, transliterations, or short/pet forms. Character localization and user-name localization require their own policy/consent layer. This family says what the pinned sources list; it is not a promise that every bearer shares one name meaning.",
  "equivalence_sets": [
    {
      "equivalence_set_id": "NFEQ.calliope.full-feminine",
      "role": "full_feminine",
      "note": "Full-name forms and equivalents only. Short and pet forms are intentionally kept in separate equivalence sets.",
      "forms": [
        {
          "form_id": "NFF.calliope.en.calliope",
          "text": "Calliope",
          "language_tag": "en",
          "script": "Latn",
          "relation_type": "source_form",
          "usage": "unknown",
          "name_id": "name_en_calliope",
          "source_refs": [
            "src_wiktionary_en_calliope_oldid_93487014"
          ],
          "review_state": "candidate"
        },
        {
          "form_id": "NFF.calliope.el.kalliopi",
          "text": "Καλλιόπη",
          "language_tag": "el",
          "script": "Grek",
          "relation_type": "local_equivalent",
          "usage": "unknown",
          "name_id": "name_el_kalliopi",
          "source_refs": [
            "src_wiktionary_en_calliope_oldid_93487014",
            "src_wiktionary_en_u39a_3b1_3bb_3bb_3b9_3cc_oldid_92480211"
          ],
          "review_state": "candidate"
        }
      ]
    }
  ],
  "localization_policy": {
    "fallback_order": [
      "reviewed_local_equivalent",
      "reviewed_traditional_adaptation",
      "reviewed_transliteration",
      "preserve_entered_form"
    ],
    "never_cross_equivalence_sets_automatically": true,
    "book_override_allowed": true,
    "user_override_allowed": true
  },
  "source_refs": [
    "src_wiktionary_en_calliope_oldid_93487014",
    "src_wiktionary_en_u39a_3b1_3bb_3bb_3b9_3cc_oldid_92480211"
  ],
  "review_state": "candidate"
}
